{"schema_name":"source-manifest","schema_version":"1.0.0","kernel_version":"2.0.0","run_id":"00000000000000000000000000000000","mode":"verified_import","adapter_id":"fixture","canonical_item_id":"offline-source-ready-001","fixture_manifest_sha256":"0000000000000000000000000000000000000000000000000000000000000000","artifacts":[{"logical_id":"video","path":"source/media/video.fixture","media_type":"application/octet-stream","sha256":"0000000000000000000000000000000000000000000000000000000000000000","size_bytes":1}]}
